data/final-report-tables/chapter-5/5.1.3-Largest-Migration-Flows-of-Lifetime-Migrants-by-District-of-Usual-Residence,-2024/raw_data.json

[
  [
    "",
    "",
    "",
    "",
    "",
    "Migrants to the District of Usual Residence",
    "",
    ""
  ],
  [
    "Usual residence",
    "Lifetime in",
    "",
    "",
    "",
    "",
    "",
    ""
  ],
  [
    "",
    "",
    "Largest stream",
    "",
    "2nd Largest stream",
    "",
    "3rd Largest stream",
    ""
  ],
  [
    "District",
    "migrants",
    "",
    "",
    "",
    "",
    "",
    ""
  ],
  [
    "",
    "",
    "District",
    "%",
    "District",
    "%",
    "District",
    "%"
  ],
  [
    "Colombo",
    "491,236",
    "Matara",
    "10.9",
    "Galle",
    "10.2",
    "Kandy",
    "9.9"
  ],
  [
    "Gampaha",
    "490,861",
    "Colombo",
    "23.4",
    "Kurunegala",
    "9.7",
    "Kandy",
    "8.4"
  ],
  [
    "Kalutara",
    "180,877",
    "Colombo",
    "33.6",
    "Galle",
    "14.9",
    "Ratnapura",
    "9.4"
  ],
  [
    "Kandy",
    "157,921",
    "Nuwara Eliya",
    "17.2",
    "Matale",
    "11.5",
    "Kegalle",
    "9.4"
  ],
  [
    "Matale",
    "78,262",
    "Kandy",
    "33.4",
    "Kurunegala",
    "12.1",
    "Anuradhapura",
    "10.3"
  ],
  [
    "Nuwara Eliya",
    "52,570",
    "Kandy",
    "36.1",
    "Badulla",
    "17.5",
    "Kegalle",
    "6.5"
  ],
  [
    "Galle",
    "88,038",
    "Matara",
    "29.2",
    "Kalutara",
    "13.0",
    "Colombo",
    "12.2"
  ],
  [
    "Matara",
    "82,457",
    "Hambantota",
    "25.2",
    "Galle",
    "23.4",
    "Colombo",
    "10.2"
  ],
  [
    "Hambantota",
    "64,982",
    "Matara",
    "38.3",
    "Ratnapura",
    "12.0",
    "Galle",
    "9.8"
  ],
  [
    "Jaffna",
    "26,104",
    "Kilinochchi",
    "22.0",
    "Mullaitivu",
    "17.0",
    "Vavuniya",
    "8.6"
  ],
  [
    "Mannar",
    "15,367",
    "Puttalam",
    "36.0",
    "Jaffna",
    "20.7",
    "Vavuniya",
    "8.4"
  ],
  [
    "Vavuniya",
    "50,012",
    "Jaffna",
    "31.9",
    "Kilinochchi",
    "9.1",
    "Mullaitivu",
    "7.9"
  ],
  [
    "Mullaitivu",
    "29,279",
    "Jaffna",
    "34.5",
    "Kilinochchi",
    "9.8",
    "Vavuniya",
    "7.3"
  ],
  [
    "Kilinochchi",
    "32,723",
    "Jaffna",
    "49.2",
    "Mullaitivu",
    "8.5",
    "Kandy",
    "8.3"
  ],
  [
    "Batticaloa",
    "19,036",
    "Ampara",
    "23.4",
    "Trincomalee",
    "11.3",
    "Badulla",
    "10.3"
  ],
  [
    "Ampara",
    "72,267",
    "Kandy",
    "19.2",
    "Badulla",
    "15.2",
    "Batticaloa",
    "8.5"
  ],
  [
    "Trincomalee",
    "33,634",
    "Anuradhapura",
    "11.6",
    "Kandy",
    "10.8",
    "Jaffna",
    "9.8"
  ],
  [
    "Kurunegala",
    "192,409",
    "Kandy",
    "12.7",
    "Gampaha",
    "12.5",
    "Puttalam",
    "11.6"
  ],
  [
    "Puttalam",
    "99,666",
    "Kurunegala",
    "27.6",
    "Gampaha",
    "14.9",
    "Mannar",
    "10.5"
  ],
  [
    "Anuradhapura",
    "144,866",
    "Kurunegala",
    "17.8",
    "Kandy",
    "14.3",
    "Matale",
    "10.9"
  ],
  [
    "Polonnaruwa",
    "93,574",
    "Kandy",
    "18.8",
    "Kurunegala",
    "11.4",
    "Kegalle",
    "10.3"
  ],
  [
    "Badulla",
    "70,437",
    "Nuwara Eliya",
    "14.9",
    "Kandy",
    "14.7",
    "Moneragala",
    "14.6"
  ],
  [
    "Moneragala",
    "81,392",
    "Badulla",
    "25.9",
    "Hambantota",
    "17.9",
    "Ratnapura",
    "11.2"
  ],
  [
    "Ratnapura",
    "89,081",
    "Hambantota",
    "14.1",
    "Matara",
    "13.1",
    "Colombo",
    "12.1"
  ],
  [
    "Kegalle",
    "95,773",
    "Kandy",
    "17.8",
    "Kurunegala",
    "14.1",
    "Colombo",
    "10.9"
  ]
]

README.md

### Original Table

![10.2-Percentage-Distribution-of-the-Number-and-of-Households-by-Sector,-District-and-Household-Type,-2024](data/final-report-tables/chapter-10/10.2-Percentage-Distribution-of-the-Number-and-of-Households-by-Sector,-District-and-Household-Type,-2024/original.png)

![10.3-Percentage-Distribution-of-the-Number-of-Household-Heads-by-Ethnic-group-of-the-Head-of-Household-and-typeof-Household,-2024](data/final-report-tables/chapter-10/10.3-Percentage-Distribution-of-the-Number-of-Household-Heads-by-Ethnic-group-of-the-Head-of-Household-and-typeof-Household,-2024/original.png)

![10.5-Percentage-Distribution-of-the-Number-of-Household-Heads-by-District,-Sex,-and-Age-Group,-2024](data/final-report-tables/chapter-10/10.5-Percentage-Distribution-of-the-Number-of-Household-Heads-by-District,-Sex,-and-Age-Group,-2024/original.png)

![11.4-Tenure-of-Housing-Units-by-Sector-and-District,-2024](data/final-report-tables/chapter-11/11.4-Tenure-of-Housing-Units-by-Sector-and-District,-2024/original.png)

![11.5-Percentage-of-Housing-Units-Owned-by-Household-Members-and-Sector,-2012-and-2024](data/final-report-tables/chapter-11/11.5-Percentage-of-Housing-Units-Owned-by-Household-Members-and-Sector,-2012-and-2024/original.png)

![11.6-Percentage-of-Housing-units-by-Materials-Used-to-Construct-Walls,-Roofs-and-Floors,](data/final-report-tables/chapter-11/11.6-Percentage-of-Housing-units-by-Materials-Used-to-Construct-Walls,-Roofs-and-Floors,/original.png)

![12.2-Deviations-of-Terminal-Digits-of-Reported-Age,-2012-and](data/final-report-tables/chapter-12/12.2-Deviations-of-Terminal-Digits-of-Reported-Age,-2012-and/original.png)

![12.5-Whipple's-Index-by-District-and-Sex,-2012-and-2024](data/final-report-tables/chapter-12/12.5-Whipple's-Index-by-District-and-Sex,-2012-and-2024/original.png)